{
  "protocolVersion": "1.0",
  "datasetId": "devorbit-public-software-repair-v1",
  "generatedAt": "2026-08-13T14:30:25.769Z",
  "disclosure": "The scored benchmark manifest is not frozen and contains no scored case or method result. One separately declared SWE-bench dev validation pilot has frozen provenance and a reproduced baseline failure; it is not a DevOrbit score or test-set claim.",
  "manifest": {
    "status": "protocol-only",
    "cases": 0,
    "sources": 2,
    "splits": {
      "train": 0,
      "validation": 0,
      "test": 0
    }
  },
  "methods": {},
  "pairwise": [],
  "manifestDigest": "sha256:2d1080f2d104597a458f4184469af5d20367f96d2a207d76105e8bad64d07e75",
  "status": "not_run"
}
